file,object_name,context_field,line_number,before,after
functions_analysis_all_schemas.json,uftn_TableGetAllAgencyChildrenByAgencyCodeOEC,chatgpt_explanation.explanation,2,"The function `uftn_TableGetAllAgencyChildrenByAgencyCodeOEC` is a multi-statement table-valued function in Microsoft SQL Server. It is designed to retrieve all child agencies associated with a given agency code. This function likely involves querying hierarchical data where agencies have parent-child relationships, and it returns a set of records representing these child agencies.","The function `uftn_TableGetAllAgencyChildrenByAgencyCodeOEC` is a multi-statement table-valued function in Microsoft SQL Server. It is designed to retrieve all child agencies associated with a given agency code. This function involves querying hierarchical data where agencies have parent-child relationships, and it returns a set of records representing these child agencies."
functions_analysis_all_schemas.json,uftn_TableGetAllAgencyChildrenByAgencyCodeOEC,chatgpt_explanation.explanation,5,"The complexity level is considered medium due to the nature of multi-statement table-valued functions, which involve multiple operations and potentially complex logic to handle hierarchical data. The function likely involves recursive logic or iterative processing to navigate through the agency hierarchy.","The complexity level is considered medium due to the nature of multi-statement table-valued functions, which involve multiple operations and complex logic to handle hierarchical data. The function involves recursive logic or iterative processing to navigate through the agency hierarchy."
functions_analysis_all_schemas.json,uftn_TableGetAllAgencyChildrenByAgencyCodeOEC,chatgpt_explanation.explanation,12,The function returns a table data type. The structure of the returned table includes columns that represent the attributes of the child agencies. These columns might include:,The function returns a table data type. The structure of the returned table includes columns that represent the attributes of the child agencies. These columns include:
functions_analysis_all_schemas.json,uftn_TableGetAllAgencyChildrenByAgencyCodeOEC,chatgpt_explanation.explanation,25,The workflow may involve recursive common table expressions (CTEs) or iterative loops to traverse the agency hierarchy.,The workflow involve recursive common table expressions (CTEs) or iterative loops to traverse the agency hierarchy.
functions_analysis_all_schemas.json,uftn_TableGetAllAgencyChildrenByAgencyCodeOEC,chatgpt_explanation.explanation,28,"- Multi-statement table-valued functions can have performance overhead due to the use of table variables, which may not benefit from indexing.","- Multi-statement table-valued functions can have performance overhead due to the use of table variables, which not benefit from indexing."
functions_analysis_all_schemas.json,uftn_TableGetAllAgencyChildrenByAgencyCodeOEC,chatgpt_explanation.explanation,33,"- If the agency hierarchy is very deep, the function may encounter performance bottlenecks or exceed recursion limits.","- If the agency hierarchy is very deep, the function encounter performance bottlenecks or exceed recursion limits."
functions_analysis_all_schemas.json,uftn_TableGetAllAgencyChildrenByAgencyCodeOEC,chatgpt_explanation.explanation,35,"- The function may not handle circular references in the hierarchy, which could lead to infinite loops or stack overflow errors.","- The function not handle circular references in the hierarchy, which lead to infinite loops or stack overflow errors."
functions_analysis_all_schemas.json,uftn_TableGetAllAgencyChildrenByAgencyCodeOEC,chatgpt_explanation.explanation,36,"- Concurrency issues might arise if the function is executed frequently in a high-transaction environment, potentially leading to locking or blocking scenarios.","- Concurrency issues arise if the function is executed frequently in a high-transaction environment, leading to locking or blocking scenarios."
functions_analysis_all_schemas.json,UDF_ActualVsBudget_GetActual,chatgpt_explanation.explanation,5,"The complexity level of this function is considered medium. This is due to the nature of multi-statement table-valued functions, which can involve multiple operations, such as data aggregation, conditional logic, and potentially complex joins or subqueries. These operations require a good understanding of SQL and database design to implement and optimize effectively.","The complexity level of this function is considered medium. This is due to the nature of multi-statement table-valued functions, which can involve multiple operations, such as data aggregation, conditional logic, and complex joins or subqueries. These operations require a good understanding of SQL and database design to implement and optimize effectively."
functions_analysis_all_schemas.json,UDF_ActualVsBudget_GetActual,chatgpt_explanation.explanation,8,"The function likely accepts several input parameters, which are used to filter and process the data. Common parameters for such a function might include:","The function accepts several input parameters, which are used to filter and process the data. Common parameters for such a function include:"
functions_analysis_all_schemas.json,UDF_ActualVsBudget_GetActual,chatgpt_explanation.explanation,17,The function returns a table data type. The structure of the returned table typically includes columns such as:,The function returns a table data type. The structure of the returned table includes columns such as:
functions_analysis_all_schemas.json,UDF_ActualVsBudget_GetActual,chatgpt_explanation.explanation,19,"- `Period`: The time period for which the actual amount is calculated, often formatted as a month or quarter.","- `Period`: The time period for which the actual amount is calculated, formatted as a month or quarter."
functions_analysis_all_schemas.json,UDF_ActualVsBudget_GetActual,chatgpt_explanation.explanation,29,"3. **Conditional Logic**: The function may include conditional logic to handle special cases, such as adjustments or exclusions of certain transactions.","3. **Conditional Logic**: The function include conditional logic to handle special cases, such as adjustments or exclusions of certain transactions."
functions_analysis_all_schemas.json,UDF_ActualVsBudget_GetActual,chatgpt_explanation.explanation,38,- **Concurrency**: High concurrency scenarios may lead to contention if the function accesses heavily used tables.,- **Concurrency**: High concurrency scenarios lead to contention if the function accesses heavily used tables.
functions_analysis_all_schemas.json,UDF_ActualVsBudget_GetActual,chatgpt_explanation.explanation,41,"- **Scalability**: As data volume grows, the performance of the function may degrade if not properly optimized.","- **Scalability**: As data volume grows, the performance of the function degrade if not properly optimized."
functions_analysis_all_schemas.json,UDF_ActualVsBudget_GetActual_ByBudgetGroup,chatgpt_explanation.explanation,5,"The complexity level of this function is considered medium due to its multi-statement nature, which involves multiple operations such as data filtering, aggregation, and possibly joining tables. The complexity is also influenced by the need to handle various input parameters and return a structured dataset.","The complexity level of this function is considered medium due to its multi-statement nature, which involves multiple operations such as data filtering, aggregation, and joining tables. The complexity is also influenced by the need to handle various input parameters and return a structured dataset."
functions_analysis_all_schemas.json,UDF_ActualVsBudget_GetActual_ByBudgetGroup,chatgpt_explanation.explanation,8,"The function likely accepts several input parameters, which could include:","The function accepts several input parameters, which include:"
functions_analysis_all_schemas.json,UDF_ActualVsBudget_GetActual_ByBudgetGroup,chatgpt_explanation.explanation,17,The function returns a table. The structure of this table typically includes columns such as:,The function returns a table. The structure of this table includes columns such as:
functions_analysis_all_schemas.json,UDF_ActualVsBudget_GetActual_ByBudgetGroup,chatgpt_explanation.explanation,29,"3. Aggregating the actual amounts, possibly involving summation or other mathematical operations.","3. Aggregating the actual amounts, involving summation or other mathematical operations."
functions_analysis_all_schemas.json,UDF_ActualVsBudget_GetActual_ByBudgetGroup,chatgpt_explanation.explanation,32,The function may also include logic to handle currency conversion if the `@Currency` parameter is provided.,The function also include logic to handle currency conversion if the `@Currency` parameter is provided.
functions_analysis_all_schemas.json,UDF_ActualVsBudget_GetActual_ByBudgetGroup,chatgpt_explanation.explanation,35,"- **Execution Plan**: As a multi-statement function, it may not benefit from inlining, which can lead to less efficient execution plans compared to inline table-valued functions.","- **Execution Plan**: As a multi-statement function, it not benefit from inlining, which can lead to less efficient execution plans compared to inline table-valued functions."
functions_analysis_all_schemas.json,UDF_ActualVsBudget_GetActual_ByBudgetGroup,chatgpt_explanation.explanation,36,"- **Resource Usage**: The function may consume more resources due to its multi-statement nature, especially if it involves complex joins or aggregations.","- **Resource Usage**: The function consume more resources due to its multi-statement nature, especially if it involves complex joins or aggregations."
functions_analysis_all_schemas.json,UDF_ActualVsBudget_GetActual_ByBudgetGroup,chatgpt_explanation.explanation,38,- **Concurrency**: The function's performance may degrade under high concurrency due to potential locking and blocking issues.,- **Concurrency**: The function's performance degrade under high concurrency due to potential locking and blocking issues.
functions_analysis_all_schemas.json,UDF_ActualVsBudget_GetActual_ByBudgetGroup,chatgpt_explanation.explanation,41,"- **Scalability**: As data volume grows, the function may become a bottleneck if not optimized properly.","- **Scalability**: As data volume grows, the function become a bottleneck if not optimized properly."
functions_analysis_all_schemas.json,UDF_ActualVsBudget_GetActual_ByBudgetGroup,chatgpt_explanation.explanation,42,"- **Maintenance**: Changes to the underlying table structures or business logic may require updates to the function, increasing maintenance overhead.","- **Maintenance**: Changes to the underlying table structures or business logic require updates to the function, increasing maintenance overhead."
functions_analysis_all_schemas.json,UDF_ActualVsBudget_GetBudget,chatgpt_explanation.explanation,5,"The complexity level of this function is considered medium due to its multi-statement nature, which involves multiple operations such as data filtering, aggregation, and possibly joins or conditional logic. The complexity arises from managing these operations efficiently within the function's logic.","The complexity level of this function is considered medium due to its multi-statement nature, which involves multiple operations such as data filtering, aggregation, and joins or conditional logic. The complexity arises from managing these operations efficiently within the function's logic."
functions_analysis_all_schemas.json,UDF_ActualVsBudget_GetBudget,chatgpt_explanation.explanation,8,"- **Parameter 1**: Typically, a date or date range parameter to specify the time period for which the budget data is required. This helps in filtering the budget records to the relevant timeframe.","- **Parameter 1**: , a date or date range parameter to specify the time period for which the budget data is required. This helps in filtering the budget records to the relevant timeframe."
functions_analysis_all_schemas.json,UDF_ActualVsBudget_GetBudget,chatgpt_explanation.explanation,13,The function returns a table. The structure of this table typically includes columns such as:,The function returns a table. The structure of this table includes columns such as:
functions_analysis_all_schemas.json,UDF_ActualVsBudget_GetBudget,chatgpt_explanation.explanation,23,"3. **Data Processing**: The function may perform calculations or aggregations on the retrieved data, such as summing budget amounts or calculating variances.","3. **Data Processing**: The function perform calculations or aggregations on the retrieved data, such as summing budget amounts or calculating variances."
functions_analysis_all_schemas.json,UDF_ActualVsBudget_GetBudget,chatgpt_explanation.explanation,24,4. **Conditional Logic**: It might include conditional statements to handle different scenarios or data conditions.,4. **Conditional Logic**: It include conditional statements to handle different scenarios or data conditions.
functions_analysis_all_schemas.json,UDF_ActualVsBudget_GetBudget,chatgpt_explanation.explanation,29,- **Resource Usage**: The function may consume significant resources if it processes large datasets or involves complex calculations.,- **Resource Usage**: The function consume significant resources if it processes large datasets or involves complex calculations.
functions_analysis_all_schemas.json,UDF_ActualVsBudget_GetBudget,chatgpt_explanation.explanation,31,"- **Parameter Sniffing**: The function's performance might be affected by parameter sniffing, where SQL Server caches execution plans based on initial parameter values.","- **Parameter Sniffing**: The function's performance be affected by parameter sniffing, where SQL Server caches execution plans based on initial parameter values."
functions_analysis_all_schemas.json,UDF_ActualVsBudget_GetBudget,chatgpt_explanation.explanation,34,"- **Scalability**: As data volume grows, the function might become a bottleneck if not optimized for performance.","- **Scalability**: As data volume grows, the function become a bottleneck if not optimized for performance."
functions_analysis_all_schemas.json,UDF_ActualVsBudget_GetBudget,chatgpt_explanation.explanation,36,- **Concurrency**: High concurrency scenarios might lead to contention if the function involves locking or resource-intensive operations.,- **Concurrency**: High concurrency scenarios lead to contention if the function involves locking or resource-intensive operations.
functions_analysis_all_schemas.json,UDF_ActualVsBudget_GetBudget_ByBudgetGroup,chatgpt_explanation.explanation,5,"The complexity level of this function is medium. While it involves multiple statements and potentially complex logic to aggregate or transform data, it is not as intricate as high-complexity functions that might involve recursive logic or extensive data manipulation. The function's complexity is primarily due to its multi-statement nature and the need to manage intermediate results.","The complexity level of this function is medium. While it involves multiple statements and complex logic to aggregate or transform data, it is not as intricate as high-complexity functions that involve recursive logic or extensive data manipulation. The function's complexity is primarily due to its multi-statement nature and the need to manage intermediate results."
functions_analysis_all_schemas.json,UDF_ActualVsBudget_GetBudget_ByBudgetGroup,chatgpt_explanation.explanation,12,The function returns a table. The structure of the returned table typically includes columns such as:,The function returns a table. The structure of the returned table includes columns such as:
functions_analysis_all_schemas.json,UDF_ActualVsBudget_GetBudget_ByBudgetGroup,chatgpt_explanation.explanation,16,"- `Other relevant columns`: Depending on the business logic, additional columns may be included to provide more context or details about the budget.","- `Other relevant columns`: Depending on the business logic, additional columns be included to provide more context or details about the budget."
functions_analysis_all_schemas.json,UDF_ActualVsBudget_GetBudget_ByBudgetGroup,chatgpt_explanation.explanation,22,3. **Data Processing**: Perform necessary calculations or transformations on the retrieved data. This may include aggregating budget amounts or joining with other tables to enrich the data.,3. **Data Processing**: Perform necessary calculations or transformations on the retrieved data. This include aggregating budget amounts or joining with other tables to enrich the data.
functions_analysis_all_schemas.json,UDF_ActualVsBudget_GetBudget_ByBudgetGroup,chatgpt_explanation.explanation,33,"- **Scalability**: As the dataset grows, the performance of the function may degrade if not properly optimized. Regular monitoring and tuning may be required.","- **Scalability**: As the dataset grows, the performance of the function degrade if not properly optimized. Regular monitoring and tuning be required."
functions_analysis_all_schemas.json,UDF_GetActualDataFromEC3,chatgpt_explanation.explanation,2,"The function `UDF_GetActualDataFromEC3` is a multi-statement table-valued function (MSTVF) in Microsoft SQL Server. This type of function allows for complex operations that involve multiple statements and can return a table as a result. The function is designed to retrieve and process data from a source referred to as ""EC3,"" which could be a table or a set of tables within the database. The function likely involves multiple steps to transform or filter the data before returning it in a tabular format.","The function `UDF_GetActualDataFromEC3` is a multi-statement table-valued function (MSTVF) in Microsoft SQL Server. This type of function allows for complex operations that involve multiple statements and can return a table as a result. The function is designed to retrieve and process data from a source referred to as ""EC3,"" which be a table or a set of tables within the database. The function involves multiple steps to transform or filter the data before returning it in a tabular format."
functions_analysis_all_schemas.json,UDF_GetActualDataFromEC3,chatgpt_explanation.explanation,8,"The input parameters for this function are not provided, but typically, such functions would include parameters that specify criteria for data retrieval, such as identifiers, date ranges, or other filtering conditions. These parameters are crucial for tailoring the function's output to specific needs or contexts.","The input parameters for this function are not provided, but , such functions would include parameters that specify criteria for data retrieval, such as identifiers, date ranges, or other filtering conditions. These parameters are crucial for tailoring the function's output to specific needs or contexts."
functions_analysis_all_schemas.json,UDF_GetActualDataFromEC3,chatgpt_explanation.explanation,11,The return type of the function is a table. The structure of this table is defined within the function and typically includes columns that represent the processed data from the EC3 source. The schema of the returned table is determined by the logic within the function and is designed to meet the requirements of the business logic it supports.,The return type of the function is a table. The structure of this table is defined within the function and includes columns that represent the processed data from the EC3 source. The schema of the returned table is determined by the logic within the function and is designed to meet the requirements of the business logic it supports.
functions_analysis_all_schemas.json,UDF_GetActualDataFromEC3,chatgpt_explanation.explanation,14,The business logic within `UDF_GetActualDataFromEC3` involves multiple SQL statements that collectively transform and prepare data for output. The workflow likely includes:,The business logic within `UDF_GetActualDataFromEC3` involves multiple SQL statements that collectively transform and prepare data for output. The workflow includes:
functions_analysis_all_schemas.json,UDF_GetActualDataFromEC3,chatgpt_explanation.explanation,23,- The function may not benefit from query plan optimizations as effectively as inline functions.,- The function not benefit from query plan optimizations as effectively as inline functions.
functions_analysis_all_schemas.json,UDF_GetActualDataFromEC3,chatgpt_explanation.explanation,32,"- Debugging and troubleshooting can be more difficult due to the multi-statement nature of the function, which may involve complex interactions between different parts of the logic.","- Debugging and troubleshooting can be more difficult due to the multi-statement nature of the function, which involve complex interactions between different parts of the logic."
functions_analysis_all_schemas.json,UDF_GetAgencyCodeById,chatgpt_explanation.explanation,2,"The function `UDF_GetAgencyCodeById` is a scalar function in Microsoft SQL Server. It is designed to retrieve the agency code associated with a given agency ID. Scalar functions return a single value, and in this case, the function likely queries a database table to find the corresponding agency code for the provided ID.","The function `UDF_GetAgencyCodeById` is a scalar function in Microsoft SQL Server. It is designed to retrieve the agency code associated with a given agency ID. Scalar functions return a single value, and in this case, the function queries a database table to find the corresponding agency code for the provided ID."
functions_analysis_all_schemas.json,UDF_GetAgencyCodeById,chatgpt_explanation.explanation,5,The complexity level of this function is low. Scalar functions typically involve straightforward operations such as retrieving a single value from a database table based on a simple query. The logic is usually simple and involves basic SQL operations like SELECT statements.,The complexity level of this function is low. Scalar functions involve straightforward operations such as retrieving a single value from a database table based on a simple query. The logic is usually simple and involves basic SQL operations like SELECT statements.
functions_analysis_all_schemas.json,UDF_GetAgencyCodeById,chatgpt_explanation.explanation,12,"The return type of the function is likely a string data type, such as VARCHAR or NVARCHAR. This is because agency codes are typically alphanumeric strings. The function returns the agency code that corresponds to the provided agency ID.","The return type of the function is a string data type, such as VARCHAR or NVARCHAR. This is because agency codes are alphanumeric strings. The function returns the agency code that corresponds to the provided agency ID."
functions_analysis_all_schemas.json,UDF_GetAgencyCodeById,chatgpt_explanation.explanation,29,"- If the function is used in a context where it is called repeatedly for large datasets, it may lead to performance bottlenecks.","- If the function is used in a context where it is called repeatedly for large datasets, it lead to performance bottlenecks."
functions_analysis_all_schemas.json,UDF_GetAgencyCodeById,chatgpt_explanation.explanation,30,"- Changes to the underlying table structure (e.g., renaming columns or changing data types) could break the function if it is not updated accordingly.","- Changes to the underlying table structure (e.g., renaming columns or changing data types) break the function if it is not updated accordingly."
functions_analysis_all_schemas.json,UDF_GetAgencyCodeById,chatgpt_explanation.explanation,31,"- If the function does not handle cases where the agency ID does not exist (e.g., returning NULL or a default value), it may lead to unexpected results or errors in the application logic.","- If the function does not handle cases where the agency ID does not exist (e.g., returning NULL or a default value), it lead to unexpected results or errors in the application logic."
functions_analysis_all_schemas.json,UDF_GetBillingPeriods,chatgpt_explanation.explanation,2,"The `UDF_GetBillingPeriods` is a multi-statement table-valued function in Microsoft SQL Server. This type of function allows for complex logic to be executed and returns a table as a result. The function is designed to calculate and return billing periods based on the input parameters provided. It likely involves multiple steps or iterations to construct the final result set, which is why it is implemented as a multi-statement function.","The `UDF_GetBillingPeriods` is a multi-statement table-valued function in Microsoft SQL Server. This type of function allows for complex logic to be executed and returns a table as a result. The function is designed to calculate and return billing periods based on the input parameters provided. It involves multiple steps or iterations to construct the final result set, which is why it is implemented as a multi-statement function."
functions_analysis_all_schemas.json,UDF_GetBillingPeriods,chatgpt_explanation.explanation,5,"The complexity level of this function is considered medium. Multi-statement table-valued functions inherently involve more complexity than scalar or inline table-valued functions due to their ability to handle multiple operations and maintain state across those operations. The complexity arises from managing the logic to calculate billing periods, which may involve date calculations, loops, or conditional logic.","The complexity level of this function is considered medium. Multi-statement table-valued functions inherently involve more complexity than scalar or inline table-valued functions due to their ability to handle multiple operations and maintain state across those operations. The complexity arises from managing the logic to calculate billing periods, which involve date calculations, loops, or conditional logic."
