file,object_name,context_field,line_number,before,after
tables_analysis_all_schemas.json,RateFactorDetail,analysis.explanation,30,"- **Index Optimization**: Evaluate the need for additional indexes based on query patterns. If queries frequently filter by individual columns like `RateFactorID` or `BudgetGroupID`, additional non-clustered indexes may improve performance.","- **Index Optimization**: Evaluate the need for additional indexes based on query patterns. If queries frequently filter by individual columns like `RateFactorID` or `BudgetGroupID`, additional non-clustered indexes improve performance."
tables_analysis_all_schemas.json,RateFactorType,analysis.explanation,2,"The `input.RateFactorType` table is a base table in a Microsoft SQL Server database, designed to store information about different rate factors. Each rate factor is uniquely identified by a `RateFactorCode`, which serves as the primary key. The table includes additional attributes such as a description, a flag indicating if the rate factor is a multiplier, a default value, and an active status flag. This table is likely used in scenarios where various rate factors need to be defined and managed, possibly for calculations or configurations in a larger application.","The `input.RateFactorType` table is a base table in a Microsoft SQL Server database, designed to store information about different rate factors. Each rate factor is uniquely identified by a `RateFactorCode`, which serves as the primary key. The table includes additional attributes such as a description, a flag indicating if the rate factor is a multiplier, a default value, and an active status flag. This table is used in scenarios where various rate factors need to be defined and managed, for calculations or configurations in a larger application."
tables_analysis_all_schemas.json,RateFactorType,analysis.explanation,10,- **Relationships**: The absence of foreign keys suggests that this table is likely a standalone entity or a lookup/reference table used by other tables in the database.,- **Relationships**: The absence of foreign keys suggests that this table is a standalone entity or a lookup/reference table used by other tables in the database.
tables_analysis_all_schemas.json,RateFactorType,analysis.explanation,13,The `input.RateFactorType` table is likely used in business scenarios where different rate factors need to be defined for calculations or configurations. Possible use cases include:,The `input.RateFactorType` table is used in business scenarios where different rate factors need to be defined for calculations or configurations. Possible use cases include:
tables_analysis_all_schemas.json,RateFactorType,analysis.explanation,24,"- **Indexes**: The table has a clustered primary key index on `RateFactorCode`, which optimizes lookups by this column. Given the table's likely role as a reference table, this indexing strategy is appropriate.","- **Indexes**: The table has a clustered primary key index on `RateFactorCode`, which optimizes lookups by this column. Given the table's role as a reference table, this indexing strategy is appropriate."
tables_analysis_all_schemas.json,RateFactorType,analysis.explanation,29,"- **Data Type Optimization**: Evaluate the `varchar(25)` size for `RateFactorCode` to ensure it aligns with actual data requirements, potentially reducing storage if a smaller size suffices.","- **Data Type Optimization**: Evaluate the `varchar(25)` size for `RateFactorCode` to ensure it aligns with actual data requirements, reducing storage if a smaller size suffices."
tables_analysis_all_schemas.json,TenantCharge,analysis.explanation,5,"The complexity level of this table is considered medium. While the table structure itself is straightforward, the inclusion of audit fields, default values, and a clustered primary key index adds a layer of complexity. The table does not include foreign keys, which simplifies its relationships with other tables but may limit its integration within a broader database schema.","The complexity level of this table is considered medium. While the table structure itself is straightforward, the inclusion of audit fields, default values, and a clustered primary key index adds a layer of complexity. The table does not include foreign keys, which simplifies its relationships with other tables but limit its integration within a broader database schema."
tables_analysis_all_schemas.json,TenantCharge,analysis.explanation,9,"- **Foreign Keys**: There are no foreign keys defined in this table, indicating it does not directly reference other tables. This suggests it may be a standalone table or part of a denormalized design.","- **Foreign Keys**: There are no foreign keys defined in this table, indicating it does not directly reference other tables. This suggests it be a standalone table or part of a denormalized design."
tables_analysis_all_schemas.json,TenantCharge,analysis.explanation,10,"- **Relationships**: The absence of foreign keys implies no direct relationships with other tables. However, it may be logically related to other tables in the database, such as a `Tenant` table, through application logic or external joins.","- **Relationships**: The absence of foreign keys implies no direct relationships with other tables. However, it be logically related to other tables in the database, such as a `Tenant` table, through application logic or external joins."
tables_analysis_all_schemas.json,TenantCharge,analysis.explanation,13,The `input.TenantCharge` table is likely used in a property management or leasing system to manage financial charges associated with tenants. Use cases include:,The `input.TenantCharge` table is used in a property management or leasing system to manage financial charges associated with tenants. Use cases include:
tables_analysis_all_schemas.json,TenantCharge,analysis.explanation,25,"- **Structure**: The table's structure, with its audit fields and default values, supports efficient data entry and retrieval. However, the absence of additional indexes may impact performance for queries that filter or sort by non-indexed columns, such as `Name` or `FY`.","- **Structure**: The table's structure, with its audit fields and default values, supports efficient data entry and retrieval. However, the absence of additional indexes impact performance for queries that filter or sort by non-indexed columns, such as `Name` or `FY`."
tables_analysis_all_schemas.json,TenantChargeDetail,analysis.explanation,9,"- **Foreign Keys**: Although not explicitly defined in the provided structure, the `TenantChargeID` and `BudgetGroupID` columns are likely candidates for foreign keys, linking to other tables that store tenant charge summaries and budget group details, respectively.","- **Foreign Keys**: Although not explicitly defined in the provided structure, the `TenantChargeID` and `BudgetGroupID` columns are candidates for foreign keys, linking to other tables that store tenant charge summaries and budget group details, respectively."
tables_analysis_all_schemas.json,TenantChargeDetail,analysis.explanation,10,"- **Relationships**: The table is likely part of a larger schema where it relates to tables containing tenant information, charge summaries, and budget details. However, these relationships are not enforced through foreign key constraints in the current structure.","- **Relationships**: The table is part of a larger schema where it relates to tables containing tenant information, charge summaries, and budget details. However, these relationships are not enforced through foreign key constraints in the current structure."
tables_analysis_all_schemas.json,TenantChargeDetail,analysis.explanation,14,- **Use Cases**: ,- **Use Cases**:
tables_analysis_all_schemas.json,TenantChargeDetail,analysis.explanation,15,  - Generating detailed charge reports for tenants., - Generating detailed charge reports for tenants.
tables_analysis_all_schemas.json,TenantChargeDetail,analysis.explanation,16,  - Calculating total charges based on percentages for budgeting purposes., - Calculating total charges based on percentages for budgeting purposes.
tables_analysis_all_schemas.json,TenantChargeDetail,analysis.explanation,17,  - Auditing and verifying charge allocations to ensure compliance with agency and budgetary guidelines., - Auditing and verifying charge allocations to ensure compliance with agency and budgetary guidelines.
tables_analysis_all_schemas.json,TenantChargeDetail,analysis.explanation,25,"- **Indexes**: The primary key index on `DetailID` is clustered, which optimizes retrieval of records by primary key. However, the lack of additional indexes may impact performance for queries filtering by `TenantChargeID`, `AgencyCode`, or `BudgetGroupID`.","- **Indexes**: The primary key index on `DetailID` is clustered, which optimizes retrieval of records by primary key. However, the lack of additional indexes impact performance for queries filtering by `TenantChargeID`, `AgencyCode`, or `BudgetGroupID`."
tables_analysis_all_schemas.json,TenantChargeDetail,analysis.explanation,26,"- **Structure**: The table's simplicity aids in quick data retrieval and insertion operations. However, as the table grows, the absence of non-clustered indexes could lead to slower query performance for non-primary key lookups.","- **Structure**: The table's simplicity aids in quick data retrieval and insertion operations. However, as the table grows, the absence of non-clustered indexes lead to slower query performance for non-primary key lookups."
tables_analysis_all_schemas.json,Tier4REC,analysis.explanation,2,"The `input.Tier4REC` table is a base table in a Microsoft SQL Server database, created to store records related to a specific tier of data, possibly for reporting or categorization purposes. The table includes fields for identification, descriptive information, fiscal year, quantity adjustments, and metadata for record creation and modification. It is designed to ensure data integrity and track changes over time.","The `input.Tier4REC` table is a base table in a Microsoft SQL Server database, created to store records related to a specific tier of data, for reporting or categorization purposes. The table includes fields for identification, descriptive information, fiscal year, quantity adjustments, and metadata for record creation and modification. It is designed to ensure data integrity and track changes over time."
tables_analysis_all_schemas.json,Tier4REC,analysis.explanation,14,"The `input.Tier4REC` table is likely used in a business context where records need to be categorized or reported based on tiers, with specific attention to fiscal years. Use cases may include:","The `input.Tier4REC` table is used in a business context where records need to be categorized or reported based on tiers, with specific attention to fiscal years. Use cases include:"
tables_analysis_all_schemas.json,Tier4REC,analysis.explanation,16,"- Maintaining an active/inactive status for records, which could be used in filtering data for reports or analyses.","- Maintaining an active/inactive status for records, which be used in filtering data for reports or analyses."
tables_analysis_all_schemas.json,Tier4REC,analysis.explanation,29,"- **Scalability**: The `decimal(4,2)` type for `QuantityAlignmentAdjustment` may limit the range of values that can be stored. Consider increasing the precision and scale if larger adjustments are anticipated.","- **Scalability**: The `decimal(4,2)` type for `QuantityAlignmentAdjustment` limit the range of values that can be stored. Consider increasing the precision and scale if larger adjustments are anticipated."
tables_analysis_all_schemas.json,vwInvoiceHasChargebacks,analysis.explanation,2,"The `invoice.vwInvoiceHasChargebacks` table is a base table in a Microsoft SQL Server database, designed to store information related to invoices that have associated chargebacks. The table includes details such as invoice identifiers, billing periods, billing types, statuses, provider information, and financial figures like total chargebacks and payments. This table is likely used to track and manage financial transactions and discrepancies related to invoices, particularly focusing on chargebacks.","The `invoice.vwInvoiceHasChargebacks` table is a base table in a Microsoft SQL Server database, designed to store information related to invoices that have associated chargebacks. The table includes details such as invoice identifiers, billing periods, billing types, statuses, provider information, and financial figures like total chargebacks and payments. This table is used to track and manage financial transactions and discrepancies related to invoices, particularly focusing on chargebacks."
tables_analysis_all_schemas.json,vwInvoiceHasChargebacks,analysis.explanation,5,"The complexity level of this table is considered medium. The table structure is straightforward with a single primary key and no foreign keys explicitly defined. However, the presence of multiple financial fields and the potential for complex business logic related to chargebacks and payments increases its complexity. The table's design suggests it is part of a larger financial or billing system, which may involve intricate relationships with other tables.","The complexity level of this table is considered medium. The table structure is straightforward with a single primary key and no foreign keys explicitly defined. However, the presence of multiple financial fields and the potential for complex business logic related to chargebacks and payments increases its complexity. The table's design suggests it is part of a larger financial or billing system, which involve intricate relationships with other tables."
tables_analysis_all_schemas.json,vwInvoiceHasChargebacks,analysis.explanation,10,"- **Relationships**: While not explicitly defined, the table likely interacts with other tables in the database, such as those managing providers, statuses, and possibly contracts, given the `ContractNumber` field.","- **Relationships**: While not explicitly defined, the table interacts with other tables in the database, such as those managing providers, statuses, and contracts, given the `ContractNumber` field."
tables_analysis_all_schemas.json,vwInvoiceHasChargebacks,analysis.explanation,25,"- **Indexes**: The table has a clustered primary key index on `InvoiceID`, which optimizes lookups by this key. However, there are no additional indexes, which could impact performance for queries filtering by other columns like `StatusID` or `ProviderID`.","- **Indexes**: The table has a clustered primary key index on `InvoiceID`, which optimizes lookups by this key. However, there are no additional indexes, which impact performance for queries filtering by other columns like `StatusID` or `ProviderID`."
tables_analysis_all_schemas.json,vwInvoiceHasChargebacks,analysis.explanation,26,"- **Structure**: The wide range of data types and the potential size of `varchar` fields (especially `ContractNumber`) could affect performance, particularly in terms of storage and retrieval speed.","- **Structure**: The wide range of data types and the potential size of `varchar` fields (especially `ContractNumber`) affect performance, particularly in terms of storage and retrieval speed."
tables_analysis_all_schemas.json,vwInvoiceHasChargebacks,analysis.explanation,32,"- **Column Size Optimization**: Evaluate the size of `varchar` fields, especially `ContractNumber`, to ensure they are appropriately sized for the data they store, potentially reducing storage requirements and improving performance.","- **Column Size Optimization**: Evaluate the size of `varchar` fields, especially `ContractNumber`, to ensure they are appropriately sized for the data they store, reducing storage requirements and improving performance."
tables_analysis_all_schemas.json,Agency,analysis.explanation,2,"The `Preload.Agency` table is designed to store information about various agencies. It includes unique identifiers, descriptive details, and metadata about creation and modification. The table is structured to ensure each agency is uniquely identifiable and can be referenced in other parts of the database, potentially for reporting or operational purposes.","The `Preload.Agency` table is designed to store information about various agencies. It includes unique identifiers, descriptive details, and metadata about creation and modification. The table is structured to ensure each agency is uniquely identifiable and can be referenced in other parts of the database, for reporting or operational purposes."
tables_analysis_all_schemas.json,Agency,analysis.explanation,10,"- **Foreign Key**: Although not explicitly defined in the provided structure, `AgencyFundingSeqid` appears to be a potential foreign key, likely referencing another table that details funding sources.","- **Foreign Key**: Although not explicitly defined in the provided structure, `AgencyFundingSeqid` is a potential foreign key, referencing another table that details funding sources."
tables_analysis_all_schemas.json,Agency,analysis.explanation,11,"- **Relationships**: The table is likely related to other tables through `AgencyID` and `AgencyFundingSeqid`, facilitating joins and data integrity across the database.","- **Relationships**: The table is related to other tables through `AgencyID` and `AgencyFundingSeqid`, facilitating joins and data integrity across the database."
tables_analysis_all_schemas.json,Agency,analysis.explanation,14,"The `Preload.Agency` table is likely used in contexts where agency information needs to be stored, retrieved, and managed. Use cases include:","The `Preload.Agency` table is used in contexts where agency information needs to be stored, retrieved, and managed. Use cases include:"
tables_analysis_all_schemas.json,Agency,analysis.explanation,21,"- **Nullability**: Most columns are non-nullable, enforcing the presence of critical data. However, `AgencyDescription`, `CreatedBy`, `ModifiedBy`, `AgencyFundingSeqid`, and `FundingSourceDescription` allow nulls, which may be acceptable for optional information.","- **Nullability**: Most columns are non-nullable, enforcing the presence of critical data. However, `AgencyDescription`, `CreatedBy`, `ModifiedBy`, `AgencyFundingSeqid`, and `FundingSourceDescription` allow nulls, which be acceptable for optional information."
tables_analysis_all_schemas.json,Agency,analysis.explanation,27,"- **Insert/Update Performance**: The default constraints on date columns and the indexes may slightly impact insert and update performance, but they provide significant benefits in terms of data integrity and retrieval speed.","- **Insert/Update Performance**: The default constraints on date columns and the indexes slightly impact insert and update performance, but they provide significant benefits in terms of data integrity and retrieval speed."
tables_analysis_all_schemas.json,Agency,analysis.explanation,31,"- **Index Optimization**: Depending on query patterns, additional indexes might be necessary to optimize performance further, especially if there are frequent queries on other columns.","- **Index Optimization**: Depending on query patterns, additional indexes be necessary to optimize performance further, especially if there are frequent queries on other columns."
tables_analysis_all_schemas.json,AgencyByFY,analysis.explanation,17,The `Preload.AgencyByFY` table is likely used in scenarios where tracking agency data across different fiscal years is necessary. This could include:,The `Preload.AgencyByFY` table is used in scenarios where tracking agency data across different fiscal years is necessary. This include:
tables_analysis_all_schemas.json,AgencyByFY,analysis.explanation,29,"- **Indexes**: The clustered index on the primary key (`[FY, AgencyID]`) is beneficial for queries that involve filtering or sorting by these columns. However, it may require careful management to ensure optimal performance as the table grows.","- **Indexes**: The clustered index on the primary key (`[FY, AgencyID]`) is beneficial for queries that involve filtering or sorting by these columns. However, it require careful management to ensure optimal performance as the table grows."
tables_analysis_all_schemas.json,AgencyByFY,analysis.explanation,30,- **Data Types**: The use of `hierarchyid` can be efficient for managing hierarchical data but may require specialized indexing or query strategies to maintain performance.,- **Data Types**: The use of `hierarchyid` can be efficient for managing hierarchical data but require specialized indexing or query strategies to maintain performance.
tables_analysis_all_schemas.json,AgencyByFY,analysis.explanation,31,"- **Default Values**: The use of `getdate()` as a default for `CreatedDate` ensures that insert operations do not require explicit date values, simplifying data entry and potentially improving performance.","- **Default Values**: The use of `getdate()` as a default for `CreatedDate` ensures that insert operations do not require explicit date values, simplifying data entry and improving performance."
tables_analysis_all_schemas.json,AgencyByFY,analysis.explanation,34,- **Composite Key Complexity**: The use of a composite primary key can complicate query design and indexing strategies. Consider whether a surrogate key might simplify certain operations.,- **Composite Key Complexity**: The use of a composite primary key can complicate query design and indexing strategies. Consider whether a surrogate key simplify certain operations.
tables_analysis_all_schemas.json,BillingPeriod,analysis.explanation,2,"The `Preload.BillingPeriod` table is designed to store information related to billing periods within a financial or budgeting context. It includes details such as the budget billing period identifier, the billing period itself, fiscal year, base year, and metadata about record creation. The table is structured to support operations that require tracking and managing billing cycles, potentially for budgeting or financial reporting purposes.","The `Preload.BillingPeriod` table is designed to store information related to billing periods within a financial or budgeting context. It includes details such as the budget billing period identifier, the billing period itself, fiscal year, base year, and metadata about record creation. The table is structured to support operations that require tracking and managing billing cycles, for budgeting or financial reporting purposes."
tables_analysis_all_schemas.json,BillingPeriod,analysis.explanation,10,- **Relationships**: The lack of foreign keys suggests that this table is likely used independently or as a reference table in queries rather than being part of a complex relational model.,- **Relationships**: The lack of foreign keys suggests that this table is used independently or as a reference table in queries rather than being part of a complex relational model.
tables_analysis_all_schemas.json,BillingPeriod,analysis.explanation,13,The table is likely used in financial applications where tracking billing periods is necessary. Use cases may include:,The table is used in financial applications where tracking billing periods is necessary. Use cases include:
tables_analysis_all_schemas.json,BillingPeriod,analysis.explanation,20,"- **Nullability**: The `BillingPeriod` and `CreatedDate` columns are non-nullable, ensuring that every record has a billing period and a creation timestamp. The `FY`, `BaseYear`, and `CreatedBy` columns are nullable, allowing flexibility in data entry where these details may not always be available.","- **Nullability**: The `BillingPeriod` and `CreatedDate` columns are non-nullable, ensuring that every record has a billing period and a creation timestamp. The `FY`, `BaseYear`, and `CreatedBy` columns are nullable, allowing flexibility in data entry where these details not always be available."
tables_analysis_all_schemas.json,BudgetGroup,analysis.explanation,10,- **Relationships**: The absence of foreign keys suggests that this table may be used independently or as a lookup/reference table in the broader database schema.,- **Relationships**: The absence of foreign keys suggests that this table be used independently or as a lookup/reference table in the broader database schema.
tables_analysis_all_schemas.json,BudgetGroup,analysis.explanation,13,The `Preload.BudgetGroup` table is likely used in financial or energy management systems to categorize and manage budget allocations related to different energy types. Use cases may include:,The `Preload.BudgetGroup` table is used in financial or energy management systems to categorize and manage budget allocations related to different energy types. Use cases include:
tables_analysis_all_schemas.json,BudgetGroup,analysis.explanation,29,"- **Column Lengths**: The `BudgetGroupDescription` column is limited to 75 characters, which may be restrictive if detailed descriptions are needed. Evaluate whether this length is sufficient for business needs.","- **Column Lengths**: The `BudgetGroupDescription` column is limited to 75 characters, which be restrictive if detailed descriptions are needed. Evaluate whether this length is sufficient for business needs."
tables_analysis_all_schemas.json,BudgetGroupByFY,analysis.explanation,13,"- **Relationships**: The table is part of a relational model where it connects fiscal years with budget groups, likely allowing for aggregation or reporting of budget data by these dimensions.","- **Relationships**: The table is part of a relational model where it connects fiscal years with budget groups, allowing for aggregation or reporting of budget data by these dimensions."
