file,object_name,context_field,line_number,before,after
tables_analysis_all_schemas.json,BudgetApp_vwBudgetGroups,analysis.explanation,20,"- **Constraints**: The absence of explicit constraints (e.g., primary key, foreign key) could lead to data anomalies. Implementing constraints would enhance data integrity.","- **Constraints**: The absence of explicit constraints (e.g., primary key, foreign key) lead to data anomalies. Implementing constraints would enhance data integrity."
tables_analysis_all_schemas.json,BudgetApp_vwBudgetGroups,analysis.explanation,21,"- **Defaults**: There are no default values specified, which could lead to NULL entries in critical fields like `Active`.","- **Defaults**: There are no default values specified, which lead to NULL entries in critical fields like `Active`."
tables_analysis_all_schemas.json,BudgetApp_vwBudgetGroups,analysis.explanation,24,"- **Indexes**: The table does not mention any indexes. Indexing `BudgetGroupId`, `CreatedBy`, and `ModifiedBy` could improve query performance, especially for lookups and joins.","- **Indexes**: The table does not mention any indexes. Indexing `BudgetGroupId`, `CreatedBy`, and `ModifiedBy` improve query performance, especially for lookups and joins."
tables_analysis_all_schemas.json,BudgetApp_vwBudgetGroups,analysis.explanation,25,"- **Structure**: The table's structure is relatively simple, but performance could be impacted by the lack of indexes and constraints, especially as the table grows.","- **Structure**: The table's structure is relatively simple, but performance be impacted by the lack of indexes and constraints, especially as the table grows."
tables_analysis_all_schemas.json,BudgetApp_vwFacilities,analysis.explanation,2,"The `EC3DB.BudgetApp_vwFacilities` table is designed to store detailed information about facilities within an organization. Each row in the table represents a unique facility, capturing various attributes such as identification numbers, physical characteristics, address details, and metadata about the record's creation and modification. This table is likely part of a larger database system used for budgeting, facility management, or real estate tracking.","The `EC3DB.BudgetApp_vwFacilities` table is designed to store detailed information about facilities within an organization. Each row in the table represents a unique facility, capturing various attributes such as identification numbers, physical characteristics, address details, and metadata about the record's creation and modification. This table is part of a larger database system used for budgeting, facility management, or real estate tracking."
tables_analysis_all_schemas.json,BudgetApp_vwFacilities,analysis.explanation,9,"- **Foreign Keys**: There are no explicit foreign key constraints defined in the provided structure. However, columns like `CreatedBy` and `ModifiedBy` could potentially reference a `Users` table or similar entity.","- **Foreign Keys**: There are no explicit foreign key constraints defined in the provided structure. However, columns like `CreatedBy` and `ModifiedBy` reference a `Users` table or similar entity."
tables_analysis_all_schemas.json,BudgetApp_vwFacilities,analysis.explanation,10,"- **Relationships**: The table likely interacts with other tables in the database, such as those storing user information, facility usage data, or financial records. However, these relationships are not detailed in the current structure.","- **Relationships**: The table interacts with other tables in the database, such as those storing user information, facility usage data, or financial records. However, these relationships are not detailed in the current structure."
tables_analysis_all_schemas.json,BudgetApp_vwFacilities,analysis.explanation,13,This table is likely used in scenarios involving:,This table is used in scenarios involving:
tables_analysis_all_schemas.json,BudgetApp_vwFacilities,analysis.explanation,21,"- **Nullability**: Many columns allow `NULL` values, which could lead to incomplete data entries. Consideration should be given to which fields are essential and should be marked as `NOT NULL`.","- **Nullability**: Many columns allow `NULL` values, which lead to incomplete data entries. Consideration should be given to which fields are essential and should be marked as `NOT NULL`."
tables_analysis_all_schemas.json,BudgetApp_vwFacilities,analysis.explanation,22,"- **Defaults**: There are no default values specified for any columns, which could be beneficial for fields like `Active` (defaulting to `1` for active facilities).","- **Defaults**: There are no default values specified for any columns, which be beneficial for fields like `Active` (defaulting to `1` for active facilities)."
tables_analysis_all_schemas.json,BudgetApp_vwFacilities,analysis.explanation,25,- **Indexes**: The table structure does not specify any indexes. Indexing `FacilityID` as a primary key would improve query performance. Additional indexes on frequently queried columns like `OecFacilityNumber` or `City` could also be beneficial.,- **Indexes**: The table structure does not specify any indexes. Indexing `FacilityID` as a primary key would improve query performance. Additional indexes on frequently queried columns like `OecFacilityNumber` or `City` also be beneficial.
tables_analysis_all_schemas.json,BudgetApp_vwProviderBudgetGroups,analysis.explanation,10,"- **Relationships**: The table likely serves as a junction table, facilitating a many-to-many relationship between budget groups and providers.","- **Relationships**: The table serves as a junction table, facilitating a many-to-many relationship between budget groups and providers."
tables_analysis_all_schemas.json,BudgetApp_vwProviderBudgetGroups,analysis.explanation,13,This table is likely used in a budgeting application to manage and track which providers are associated with specific budget groups. Use cases include:,This table is used in a budgeting application to manage and track which providers are associated with specific budget groups. Use cases include:
tables_analysis_all_schemas.json,BudgetApp_vwProviderBudgetGroups,analysis.explanation,24,"- **Indexes**: The table has a clustered primary key index on `[BudgetGroupDEM, Provider]`. This index will optimize queries that filter or join on these columns, which are likely common operations given the table's purpose.","- **Indexes**: The table has a clustered primary key index on `[BudgetGroupDEM, Provider]`. This index will optimize queries that filter or join on these columns, which are common operations given the table's purpose."
tables_analysis_all_schemas.json,BudgetApp_vwProviderBudgetGroups,analysis.explanation,25,- **Structure**: The simplicity of the table structure with only two columns and a single index suggests that performance will generally be efficient for its intended operations.,- **Structure**: The simplicity of the table structure with only two columns and a single index suggests that performance will be efficient for its intended operations.
tables_analysis_all_schemas.json,BudgetApp_vwProviders,analysis.explanation,2,"The `EC3DB.BudgetApp_vwProviders` table is a base table within a Microsoft SQL Server database, designed to store information about providers in a budget application context. The table includes columns for identifying providers, describing them, tracking creation and modification metadata, and indicating their active status. This table is likely used to manage and reference provider information within the application.","The `EC3DB.BudgetApp_vwProviders` table is a base table within a Microsoft SQL Server database, designed to store information about providers in a budget application context. The table includes columns for identifying providers, describing them, tracking creation and modification metadata, and indicating their active status. This table is used to manage and reference provider information within the application."
tables_analysis_all_schemas.json,BudgetApp_vwProviders,analysis.explanation,9,"- **Foreign Keys**: There are no foreign keys mentioned, indicating that this table may not directly reference other tables or be referenced by others in the provided context.","- **Foreign Keys**: There are no foreign keys mentioned, indicating that this table not directly reference other tables or be referenced by others in the provided context."
tables_analysis_all_schemas.json,BudgetApp_vwProviders,analysis.explanation,10,"- **Relationships**: Without foreign keys or additional context, this table appears to be standalone. However, it might be related to other tables in the application through logical relationships, such as linking `ProviderID` to transactions or contracts.","- **Relationships**: Without foreign keys or additional context, this table is standalone. However, it be related to other tables in the application through logical relationships, such as linking `ProviderID` to transactions or contracts."
tables_analysis_all_schemas.json,BudgetApp_vwProviders,analysis.explanation,18,"- **Constraints**: The `ProviderID` column is `NOT NULL`, ensuring that every record has a unique identifier. Other columns are nullable, which may lead to incomplete data if not managed properly.","- **Constraints**: The `ProviderID` column is `NOT NULL`, ensuring that every record has a unique identifier. Other columns are nullable, which lead to incomplete data if not managed properly."
tables_analysis_all_schemas.json,BudgetApp_vwProviders,analysis.explanation,19,"- **Nullability**: The nullable columns (`ProviderName`, `ProviderDescription`, `FMSIdNumber`, `CreatedDate`, `CreatedBy`, `ModifiedDate`, `ModifiedBy`, `Active`) suggest that these fields are optional, which could impact data quality if not handled correctly.","- **Nullability**: The nullable columns (`ProviderName`, `ProviderDescription`, `FMSIdNumber`, `CreatedDate`, `CreatedBy`, `ModifiedDate`, `ModifiedBy`, `Active`) suggest that these fields are optional, which impact data quality if not handled correctly."
tables_analysis_all_schemas.json,BudgetApp_vwProviders,analysis.explanation,23,"- **Indexes**: There is no mention of indexes, which could impact query performance, especially if the table grows large. Indexing `ProviderID` would be beneficial for lookups and joins.","- **Indexes**: There is no mention of indexes, which impact query performance, especially if the table grows large. Indexing `ProviderID` would be beneficial for lookups and joins."
tables_analysis_all_schemas.json,BudgetApp_vwProviders,analysis.explanation,24,"- **Data Retrieval**: The absence of indexes might slow down retrieval operations, particularly when filtering by `ProviderID` or `Active` status.","- **Data Retrieval**: The absence of indexes slow down retrieval operations, particularly when filtering by `ProviderID` or `Active` status."
tables_analysis_all_schemas.json,CrisNationalGridWest_AgencyRefundCheckTotalAmount,analysis.explanation,2,"The table `EC3DB.CrisNationalGridWest_AgencyRefundCheckTotalAmount` is a base table in a Microsoft SQL Server database. It appears to store financial data related to agency refund checks, specifically for a billing period and associated with a particular agency code. The table includes three columns: `BillingPeriod`, `AgencyCodeOEC`, and `AgencyRefundCheckAmount`. The table was created and last modified on August 25, 2025.","The table `EC3DB.CrisNationalGridWest_AgencyRefundCheckTotalAmount` is a base table in a Microsoft SQL Server database. It store financial data related to agency refund checks, specifically for a billing period and associated with a particular agency code. The table includes three columns: `BillingPeriod`, `AgencyCodeOEC`, and `AgencyRefundCheckAmount`. The table was created and last modified on August 25, 2025."
tables_analysis_all_schemas.json,CrisNationalGridWest_AgencyRefundCheckTotalAmount,analysis.explanation,8,"- **Primary Keys**: There is no primary key defined in this table. This absence means there is no enforced uniqueness for any combination of columns, which could lead to duplicate records.","- **Primary Keys**: There is no primary key defined in this table. This absence means there is no enforced uniqueness for any combination of columns, which lead to duplicate records."
tables_analysis_all_schemas.json,CrisNationalGridWest_AgencyRefundCheckTotalAmount,analysis.explanation,10,"- **Relationships**: Without primary or foreign keys, the table does not participate in explicit relational database relationships. It may be used in conjunction with other tables through application logic or queries.","- **Relationships**: Without primary or foreign keys, the table does not participate in explicit relational database relationships. It be used in conjunction with other tables through application logic or queries."
tables_analysis_all_schemas.json,CrisNationalGridWest_AgencyRefundCheckTotalAmount,analysis.explanation,13,"This table is likely used to track the total amount of refund checks issued to agencies within a specific billing period. The `BillingPeriod` column suggests periodic financial reporting or reconciliation. The `AgencyCodeOEC` serves as an identifier for the agency, while `AgencyRefundCheckAmount` records the monetary value of refunds. Use cases may include:","This table is used to track the total amount of refund checks issued to agencies within a specific billing period. The `BillingPeriod` column suggests periodic financial reporting or reconciliation. The `AgencyCodeOEC` serves as an identifier for the agency, while `AgencyRefundCheckAmount` records the monetary value of refunds. Use cases include:"
tables_analysis_all_schemas.json,CrisNationalGridWest_AgencyRefundCheckTotalAmount,analysis.explanation,19,"- **Nullability**: All columns are nullable, which could lead to incomplete data entries. For example, a record without a `BillingPeriod` or `AgencyCodeOEC` might not be meaningful.","- **Nullability**: All columns are nullable, which lead to incomplete data entries. For example, a record without a `BillingPeriod` or `AgencyCodeOEC` not be meaningful."
tables_analysis_all_schemas.json,CrisNationalGridWest_AgencyRefundCheckTotalAmount,analysis.explanation,20,"- **Constraints**: There are no constraints such as primary keys or unique constraints, which could lead to data duplication or integrity issues.","- **Constraints**: There are no constraints such as primary keys or unique constraints, which lead to data duplication or integrity issues."
tables_analysis_all_schemas.json,CrisNationalGridWest_AgencyRefundCheckTotalAmount,analysis.explanation,24,"- **Indexes**: The absence of indexes could lead to performance issues when querying large datasets, especially if frequent searches or aggregations are performed on `BillingPeriod` or `AgencyCodeOEC`.","- **Indexes**: The absence of indexes lead to performance issues when querying large datasets, especially if frequent searches or aggregations are performed on `BillingPeriod` or `AgencyCodeOEC`."
tables_analysis_all_schemas.json,CrisNationalGridWest_AgencyRefundCheckTotalAmount,analysis.explanation,25,- **Structure**: The simple structure minimizes overhead but may not be optimized for performance in complex queries or joins.,- **Structure**: The simple structure minimizes overhead but not be optimized for performance in complex queries or joins.
tables_analysis_all_schemas.json,CrisNationalGridWest_AgencyRefundCheckTotalAmount,analysis.explanation,28,- **Define a Primary Key**: Introduce a primary key to ensure each record is unique. This could be a composite key of `BillingPeriod` and `AgencyCodeOEC` if each combination should be unique.,- **Define a Primary Key**: Introduce a primary key to ensure each record is unique. This be a composite key of `BillingPeriod` and `AgencyCodeOEC` if each combination should be unique.
tables_analysis_all_schemas.json,Factors_ConversionEquivalentsForBtuAndCO2e,analysis.explanation,8,"- The table includes a primary key and a clustered index, but lacks foreign keys, suggesting it may not be directly linked to other tables, reducing relational complexity.","- The table includes a primary key and a clustered index, but lacks foreign keys, suggesting it not be directly linked to other tables, reducing relational complexity."
tables_analysis_all_schemas.json,Factors_ConversionEquivalentsForBtuAndCO2e,analysis.explanation,12,"- **Foreign Keys**: There are no explicit foreign keys defined in this table, indicating it may function independently or be referenced by other tables without direct relational constraints.","- **Foreign Keys**: There are no explicit foreign keys defined in this table, indicating it function independently or be referenced by other tables without direct relational constraints."
tables_analysis_all_schemas.json,Factors_ConversionEquivalentsForBtuAndCO2e,analysis.explanation,13,"- **Relationships**: The absence of foreign keys suggests that this table might be used as a reference or lookup table, providing conversion factors for other processes or tables in the database.","- **Relationships**: The absence of foreign keys suggests that this table be used as a reference or lookup table, providing conversion factors for other processes or tables in the database."
tables_analysis_all_schemas.json,Factors_ConversionEquivalentsForBtuAndCO2e,analysis.explanation,16,- **Energy and Emissions Reporting**: This table is likely used in applications that require detailed reporting on energy consumption and emissions. It provides necessary conversion factors to translate energy usage into standardized units (MMBtus) and calculate CO2e emissions.,- **Energy and Emissions Reporting**: This table is used in applications that require detailed reporting on energy consumption and emissions. It provides necessary conversion factors to translate energy usage into standardized units (MMBtus) and calculate CO2e emissions.
tables_analysis_all_schemas.json,Factors_ConversionEquivalentsForBtuAndCO2e,analysis.explanation,17,- **Regulatory Compliance**: Organizations may use this table to ensure compliance with environmental regulations by accurately reporting energy usage and emissions.,- **Regulatory Compliance**: Organizations use this table to ensure compliance with environmental regulations by accurately reporting energy usage and emissions.
tables_analysis_all_schemas.json,Factors_ConversionEquivalentsForBtuAndCO2e,analysis.explanation,22,"- **Nullability**: Several columns allow NULL values, which could lead to incomplete data if not handled properly. For instance, `EnergyDeliveryType`, `EnergyType`, and `CalendarYear` are nullable, which might affect data completeness and accuracy.","- **Nullability**: Several columns allow NULL values, which lead to incomplete data if not handled properly. For instance, `EnergyDeliveryType`, `EnergyType`, and `CalendarYear` are nullable, which affect data completeness and accuracy."
tables_analysis_all_schemas.json,Factors_ConversionEquivalentsForBtuAndCO2e,analysis.explanation,26,"- **Indexes**: The table has a clustered index on the primary key, which optimizes queries that retrieve records by `ConversionEquivalentsForBtuAndCO2eSeqId`. However, the absence of additional indexes might affect performance for queries filtering by other columns, such as `EnergyType` or `CalendarYear`.","- **Indexes**: The table has a clustered index on the primary key, which optimizes queries that retrieve records by `ConversionEquivalentsForBtuAndCO2eSeqId`. However, the absence of additional indexes affect performance for queries filtering by other columns, such as `EnergyType` or `CalendarYear`."
tables_analysis_all_schemas.json,Factors_ConversionEquivalentsForBtuAndCO2e,analysis.explanation,27,"- **Data Types**: The use of decimal data types with high precision is appropriate for calculations involving energy and emissions, but it may increase storage requirements and processing time.","- **Data Types**: The use of decimal data types with high precision is appropriate for calculations involving energy and emissions, but it increase storage requirements and processing time."
tables_analysis_all_schemas.json,Factors_DegreeDayBase,analysis.explanation,2,"The `EC3DB.Factors_DegreeDayBase` table is designed to store data related to degree days, which are a measure used to estimate energy requirements for heating and cooling. The table captures information about cooling and heating degree days for specific billing periods, likely for energy consumption analysis. It includes metadata about the user who added the data and timestamps for when the data was added or last updated.","The `EC3DB.Factors_DegreeDayBase` table is designed to store data related to degree days, which are a measure used to estimate energy requirements for heating and cooling. The table captures information about cooling and heating degree days for specific billing periods, for energy consumption analysis. It includes metadata about the user who added the data and timestamps for when the data was added or last updated."
tables_analysis_all_schemas.json,Factors_DegreeDayBase,analysis.explanation,9,"- **Foreign Keys**: There are no explicit foreign keys, suggesting this table might be standalone or relationships are managed at the application level.","- **Foreign Keys**: There are no explicit foreign keys, suggesting this table be standalone or relationships are managed at the application level."
tables_analysis_all_schemas.json,Factors_DegreeDayBase,analysis.explanation,11,"- **Relationships**: The absence of foreign keys implies no direct relationships with other tables, but logical relationships might exist based on `BillingPeriod` or `AuthenticatedUserID`.","- **Relationships**: The absence of foreign keys implies no direct relationships with other tables, but logical relationships exist based on `BillingPeriod` or `AuthenticatedUserID`."
tables_analysis_all_schemas.json,Factors_DegreeDayBase,analysis.explanation,14,This table is likely used in the energy sector for:,This table is used in the energy sector for:
tables_analysis_all_schemas.json,Factors_DegreeDayBase,analysis.explanation,21,"- **Nullability**: Most columns are non-nullable, enforcing data completeness for critical fields. However, `MM`, `DateAdded`, and `LastUpdate` allow nulls, which could lead to incomplete records if not handled properly.","- **Nullability**: Most columns are non-nullable, enforcing data completeness for critical fields. However, `MM`, `DateAdded`, and `LastUpdate` allow nulls, which lead to incomplete records if not handled properly."
tables_analysis_all_schemas.json,Factors_DegreeDayBase,analysis.explanation,22,"- **Data Types**: The use of `varchar` for `BillingPeriod`, `DateAdded`, and `LastUpdate` might lead to inconsistencies if not validated, as these fields represent structured data (dates and periods).","- **Data Types**: The use of `varchar` for `BillingPeriod`, `DateAdded`, and `LastUpdate` lead to inconsistencies if not validated, as these fields represent structured data (dates and periods)."
tables_analysis_all_schemas.json,Factors_DegreeDayBase,analysis.explanation,26,- **Data Retrieval**: Queries filtering by `BillingPeriod` or `AuthenticatedUserID` might benefit from additional indexes if these columns are frequently used in WHERE clauses.,- **Data Retrieval**: Queries filtering by `BillingPeriod` or `AuthenticatedUserID` benefit from additional indexes if these columns are frequently used in WHERE clauses.
tables_analysis_all_schemas.json,Factors_DegreeDayBase,analysis.explanation,33,"- **Data Validation**: Ensure that `BillingPeriod` and date fields are validated to prevent inconsistent data entry, possibly through constraints or application logic.","- **Data Validation**: Ensure that `BillingPeriod` and date fields are validated to prevent inconsistent data entry, through constraints or application logic."
tables_analysis_all_schemas.json,Factors_DegreeDayNormalized30YearAverage,analysis.explanation,2,"The `EC3DB.Factors_DegreeDayNormalized30YearAverage` table is designed to store normalized degree day data over a 30-year average period. Degree days are a measure used to estimate energy requirements for heating and cooling. This table likely serves as a reference or analytical dataset for energy consumption analysis, providing historical degree day averages that can be used to normalize current data against historical trends.","The `EC3DB.Factors_DegreeDayNormalized30YearAverage` table is designed to store normalized degree day data over a 30-year average period. Degree days are a measure used to estimate energy requirements for heating and cooling. This table serves as a reference or analytical dataset for energy consumption analysis, providing historical degree day averages that can be used to normalize current data against historical trends."
tables_analysis_all_schemas.json,Factors_DegreeDayNormalized30YearAverage,analysis.explanation,9,"- **Foreign Keys**: There are no explicit foreign keys defined in this table, indicating it may not directly reference other tables or be referenced by others in a relational manner.","- **Foreign Keys**: There are no explicit foreign keys defined in this table, indicating it not directly reference other tables or be referenced by others in a relational manner."
tables_analysis_all_schemas.json,Factors_DegreeDayNormalized30YearAverage,analysis.explanation,11,- **Relationships**: The absence of foreign keys suggests this table might be used in a denormalized context or as a standalone reference table.,- **Relationships**: The absence of foreign keys suggests this table be used in a denormalized context or as a standalone reference table.
